,Brand,Current_price,Discount,Avg_review_outof5,Num_reviews,Product_category,Date_retrieved
,Brand,Current_price,Discount,Avg_review_outof5,Num_reviews,Product_category,Date_retrieved
Baro Drywear The Brockton Rain Jacket - Men's,Baro Drywear,327.95,0,3.7,3,clothing,2020-10-17
Fjallraven Greenland No. 1 Down Jacket - Men's,Fjallraven,599.95,0,5,3,clothing,2020-10-17
MEC Cliffton Cargo Pants - Men's,MEC,74.95,0,5,1,clothing,2020-10-17
Patagonia Lightweight Synchilla Snap-Tee Pullover - Men's,Patagonia,149,0,5,3,clothing,2020-10-17
Fjallraven Yupik Parka - Men's,Fjallraven,579.95,0,3.7,3,clothing,2020-10-17
The North Face McMurdo Parka - Men's,The North Face,449.99,0,2.9,7,clothing,2020-10-17
Patagonia Torrentshell 3 Layer Jacket - Men's,Patagonia,189,0,3,3,clothing,2020-10-17
Cotopaxi Dorado Half Zip Fleece - Men's,Cotopaxi,129.95,0,0,0,clothing,2020-10-17
MEC Peak Comfort AirGrid Lite Long Sleeve Base Layer - Men's,MEC,34.95,0,4,1,clothing,2020-10-17
Fjallraven Ovik Round Neck Sweater - Men's,Fjallraven,174.95,0,5,1,clothing,2020-10-17
MEC Synergy HD Gore-Tex Jacket - Men's,MEC,399.95,0,3.7,3,clothing,2020-10-17
MEC Transference Gore-Tex Rain Jacket - Men's,MEC,249.95,0,4.4,7,clothing,2020-10-17
MEC Aquanator Rain Jacket - Men's,MEC,139.95,50,4.6,5,clothing,2020-10-17
MEC Hydrofoil Stretch Jacket - Men's,MEC,189.95,0,4.1,16,clothing,2020-10-17
MEC Flash Cloud Gore-Tex Jacket - Men's,MEC,274.95,0,4.2,4,clothing,2020-10-17
Patagonia Better Sweater Jacket - Men's,Patagonia,169,0,3.3,7,clothing,2020-10-17
Patagonia Down Sweater - Men's,Patagonia,285,30,4.2,17,clothing,2020-10-17
Arc'teryx Atom LT Hoody - Men's,Arc'teryx,319.95,0,4.8,396,clothing,2020-10-17
MEC Hydrofoil Stretch Pants - Men's,MEC,129.95,0,0,0,clothing,2020-10-17
MEC Aquanator Rain Pants - Men's,MEC,79.95,50,4.2,4,clothing,2020-10-17
Arc'teryx Covert Cardigan - Men's,Arc'teryx,199.95,0,4.1,83,clothing,2020-10-17
MEC Flash Cloud Gore-Tex Pants - Men's,MEC,239.95,0,4.3,3,clothing,2020-10-17
MEC Drencher Pants - Men's,MEC,69.95,0,3.7,56,clothing,2020-10-17
MEC Aquadash Packable Waterproof Cycling Rain Pants - Men's,MEC,119.95,0,4,4,clothing,2020-10-17
MEC Aden Rain Jacket - Men's,MEC,149.95,0,4,3,clothing,2020-10-17
MEC Alpine Ally Pants - Men's,MEC,189.95,0,4,9,clothing,2020-10-17
"Prana Brion Pants 32"" Inseam - Men's",Prana,71.97,39,4.5,8,clothing,2020-10-17
MEC Mochilero Stretch Pants - Men's,MEC,79.95,0,3.8,9,clothing,2020-10-17
MEC Borderland Pants - Men's,MEC,99.95,50,4.8,4,clothing,2020-10-17
Patagonia Better Sweater 1/4 Zip - Men's,Patagonia,149,0,4.5,4,clothing,2020-10-17
The North Face Paramount Trail Convertible Pants - Men's,The North Face,52.93,43,0,0,clothing,2020-10-17
Arc'teryx Covert 1/2 Zip Pullover - Men's,Arc'teryx,179.95,0,4.4,18,clothing,2020-10-17
MEC Tremblant Jacket - Men's,MEC,229.95,0,4.5,40,clothing,2020-10-17
Patagonia Lone Mountain 3-in-1 Jacket - Men's,Patagonia,475,30,0,0,clothing,2020-10-17
MEC Boundary Light Down Jacket - Men's,MEC,189.95,0,4.4,8,clothing,2020-10-17
MEC Trax Nordic Soft Shell Pants - Men's,MEC,134.95,0,5,2,clothing,2020-10-17
Kuhl Interceptr Jacket - Men's,Kuhl,78.38,44,0,0,clothing,2020-10-17
Showers Pass Transit Jacket CC - Men's,Showers Pass,199.95,0,3.7,15,clothing,2020-10-17
Arc'teryx Beta SL Hybrid Gore-Tex Jacket - Men's,Arc'teryx,499.95,0,4.2,52,clothing,2020-10-17
MEC Great Northern Down Parka - Men's,MEC,359.95,0,4.2,14,clothing,2020-10-17
MEC All Day Essentials Merino Lite Long Sleeve Tee - Men's,MEC,69.95,0,3.6,5,clothing,2020-10-17
Arc'teryx Cerium LT Hoody - Men's,Arc'teryx,449.95,0,4.3,168,clothing,2020-10-17
MEC Boundary Light Down Vest - Men's,MEC,149.95,0,4.7,3,clothing,2020-10-17
MEC Mochilero Stretch Convertible Pants - Men's,MEC,89.95,0,3.9,9,clothing,2020-10-17
MEC Trek Pants - Men's,MEC,69.95,0,3.3,19,clothing,2020-10-17
MEC Mochilero Cargo Pants - Men's,MEC,89.95,0,5,1,clothing,2020-10-17
MEC Prospect Fleece Jacket - Men's,MEC,114.95,0,3,6,clothing,2020-10-17
Fjallraven Vidda Pro Ventilated Trousers - Men's,Fjallraven,199.95,0,4,1,clothing,2020-10-17
MEC T3 Long Johns - Men's,MEC,44.95,0,3.7,25,clothing,2020-10-17
Patagonia Topley Jacket - Men's,Patagonia,499,0,3.6,8,clothing,2020-10-17
Patagonia Nano Puff Jacket - Men's,Patagonia,249,0,4.5,10,clothing,2020-10-17
Prana Moaby Pants - Men's,Prana,67.97,20,4,1,clothing,2020-10-17
Tentree Benson Flannel Shirt - Men's,Tentree,88.95,0,0,0,clothing,2020-10-17
MEC Aura Hoodie - Men's,MEC,149.95,0,4,1,clothing,2020-10-17
MEC Great Northern Down Bomber - Men's,MEC,339.95,44,4.7,3,clothing,2020-10-17
Showers Pass Refuge Jacket - Men's,Showers Pass,379.95,0,4.6,111,clothing,2020-10-17
Kuhl Rebel Pants - Men's,Kuhl,47.93,50,3.8,4,clothing,2020-10-17
Smartwool Merino 250 Baselayer Bottoms - Men's,Smartwool,129.95,0,0,0,clothing,2020-10-17
Fjallraven Fjallglim Long Sleeve Shirt - Men's,Fjallraven,129.95,0,5,1,clothing,2020-10-17
Patagonia Lightweight Synchilla Snap-T Pants - Men's,Patagonia,125,0,4,1,clothing,2020-10-17
Patagonia Nano Puff Vest - Men's,Patagonia,189,0,5,1,clothing,2020-10-17
MEC Tobo Softshell Pants - Men's,MEC,124.95,0,4.6,5,clothing,2020-10-17
Patagonia Quandary Pants - Men's,Patagonia,99,0,4.5,4,clothing,2020-10-17
Patagonia Tres 3-in-1 Parka - Men's,Patagonia,749,30,3,2,clothing,2020-10-17
Patagonia Micro Puff Hoody - Men's,Patagonia,375,0,5,5,clothing,2020-10-17
Fjallraven Raven Lite Jacket - Men's,Fjallraven,167.93,40,3,1,clothing,2020-10-17
Tentree Oberon Hoodie - Men's,Tentree,87.95,0,0,0,clothing,2020-10-17
Patagonia Fjord Lightweight Flannel Shirt - Men's,Patagonia,99,0,4,3,clothing,2020-10-17
MEC Transfer Reflect Pants - Men's,MEC,79.95,0,4.6,7,clothing,2020-10-17
MEC All Day Essentials Merino Lite T-Shirt - Men's,MEC,69.95,0,5,1,clothing,2020-10-17
MEC Rockwall Half Zip Midlayer - Men's,MEC,89.95,0,4,2,clothing,2020-10-17
Smartwool Merino 150 Baselayer Long Sleeve Crew - Men's,Smartwool,109.95,0,5,1,clothing,2020-10-17
The North Face Thermoball Eco Snow Triclimate Jacket - Men's,The North Face,459.99,0,0,0,clothing,2020-10-17
Fjallraven High Coast Trousers Zip Off - Men's,Fjallraven,104.94,40,0,0,clothing,2020-10-17
Fjallraven Sten Jacket - Men's,Fjallraven,239.95,0,4,2,clothing,2020-10-17
Arc'teryx Delta LT Jacket - Men's,Arc'teryx,149.95,0,4.4,84,clothing,2020-10-17
Arc'teryx Motus AR Long Sleeve Zip Neck - Men's,Arc'teryx,99.95,0,5,2,clothing,2020-10-17
MEC Mica 2 Pants - Men's,MEC,74.95,0,3.1,33,clothing,2020-10-17
Tentree Atlas Sweat Pants - Men's,Tentree,77.95,0,4,2,clothing,2020-10-17
MEC Rural Camp Pants - Men's,MEC,79.95,0,4.5,4,clothing,2020-10-17
Patagonia Reversible Bivy Down Vest - Men's,Patagonia,249,0,0,0,clothing,2020-10-17
Showers Pass Syncline CC Jacket - Men's,Showers Pass,169.95,0,2.5,2,clothing,2020-10-17
MEC Merino T3 Long Johns - Men's,MEC,59.95,0,2.1,8,clothing,2020-10-17
Brooks Spartan Pants - Men's,Brooks,74.95,0,4.1,10,clothing,2020-10-17
Patagonia Jackson Glacier Jacket - Men's,Patagonia,435,0,4,1,clothing,2020-10-17
MEC Cliffton Pants - Men's,MEC,69.95,0,3.7,3,clothing,2020-10-17
MEC Transfer Ease Pants - Men's,MEC,69.95,0,4,4,clothing,2020-10-17
Patagonia Capilene Cool Trail Long Sleeve Shirt - Men's,Patagonia,59,0,5,1,clothing,2020-10-17
Fjallraven Vardag Sweater - Men's,Fjallraven,94.95,0,0,0,clothing,2020-10-17
MEC Rockwall Midlayer - Men's,MEC,99.95,0,4.4,11,clothing,2020-10-17
MEC T2 Long Johns - Men's,MEC,34.95,0,3.7,6,clothing,2020-10-17
MEC All Day Active Long Sleeve Henley - Men's,MEC,39.95,0,4.2,4,clothing,2020-10-17
MEC Prospect Fleece Pullover - Men's,MEC,94.95,0,5,1,clothing,2020-10-17
MEC Flex Nordic Hybrid Softshell Jacket - Men's,MEC,134.95,0,5,2,clothing,2020-10-17
Showers Pass Refuge Pants - Men's,Showers Pass,319.95,0,4.6,57,clothing,2020-10-17
Fjallraven Keb Trousers - Men's,Fjallraven,249.95,20,4.2,5,clothing,2020-10-17
Fjallraven Sormland Tapered Trousers - Men's,Fjallraven,174.95,0,4.5,2,clothing,2020-10-17
MEC In-Flight Crew Neck - Men's,MEC,74.95,30,4,2,clothing,2020-10-17
The North Face Mountain Sweatshirt Hoodie 3.0 - Men's,The North Face,95.93,52,0,0,clothing,2020-10-17
"Prana Bridger Jeans 32"" Inseam - Men's",Prana,87.97,20,4.2,4,clothing,2020-10-17
MEC Chilcotins Long Sleeve Utility Shirt - Men's,MEC,49.93,44,4.5,4,clothing,2020-10-17
MEC Flex Nordic Hybrid Softshell Pants - Men's,MEC,114.95,0,3.8,4,clothing,2020-10-17
Fjallraven Lada Sweater - Men's,Fjallraven,189.95,0,5,1,clothing,2020-10-17
Fjallraven Ovik Flannel Long Sleeve Shirt - Men's,Fjallraven,94.95,0,5,1,clothing,2020-10-17
Black Diamond Mercury Mitts - Men's,Black Diamond,124.95,0,4,27,clothing,2020-10-17
MEC Surprise Gloves 2019 - Men's,MEC,39.95,0,4.7,6,clothing,2020-10-17
MEC Aura Vest - Men's,MEC,99.95,0,0,0,clothing,2020-10-17
MEC Peak Comfort AirGrid Lite Base Layer Bottoms - Men's,MEC,39.95,0,0,0,clothing,2020-10-17
Tentree Juniper Classic Hoodie - Men's,Tentree,77.95,0,0,0,clothing,2020-10-17
Xcel Ventx Heather Long Sleeve - Men's,Xcel,41.94,30,4.7,3,clothing,2020-10-17
Tentree Henley Classic Long Sleeve - Men's,Tentree,44.95,0,0,0,clothing,2020-10-17
MEC Synergy Gore-Tex Pants - Men's,MEC,169.93,48,3.5,13,clothing,2020-10-17
MEC In-Flight Hoodie - Men's,MEC,94.95,30,3.5,2,clothing,2020-10-17
"Prana Ulterior Pant 32"" Inseam - Men's",Prana,79.97,19,0,0,clothing,2020-10-17
Houdini Outright Houdi - Men's,Houdini,149.94,44,0,0,clothing,2020-10-17
MEC Mica 2 Straight Leg Pants - Men's,MEC,79.95,53,4.7,3,clothing,2020-10-17
MEC Classic Graphic T-shirt - Men's,MEC,24.95,0,3.2,11,clothing,2020-10-17
Castelli Lightness 2 Gloves - Men's,Castelli,49.95,0,0,0,clothing,2020-10-17
MEC Surprise Mitts - Men's,MEC,39.95,0,3.3,6,clothing,2020-10-17
Patagonia Silent Down Shirt - Men's,Patagonia,285,30,0,0,clothing,2020-10-17
MEC Core Train Long Sleeve T-Shirt - Men's,MEC,44.95,0,4.1,8,clothing,2020-10-17
Fjallraven Canada Shirt - Men's,Fjallraven,184.95,0,3.5,2,clothing,2020-10-17
"Prana Vaha Pants (32"" Inseam) - Men's",Prana,71.97,20,5,1,clothing,2020-10-17
Saxx Quest 2.0 Boxers - Men's,Saxx,34.95,0,4.8,12,clothing,2020-10-17
MEC All Day Active V-Neck T-shirt - Men's,MEC,32.95,0,4,4,clothing,2020-10-17
MEC Classic Long Sleeve T-shirt - Men's,MEC,19.95,0,4.2,8,clothing,2020-10-17
MEC Travel Light Jacket - Men's,MEC,39.93,50,5,1,clothing,2020-10-17
Arc'teryx Covert Hoody - Men's,Arc'teryx,219.95,0,4.5,46,clothing,2020-10-17
DU/ER Adventure Pants - Men's,DU/ER,147.95,0,4.7,10,clothing,2020-10-17
MEC Trax Nordic Soft Shell Jacket - Men's,MEC,144.95,0,3.7,3,clothing,2020-10-17
MEC All Day Essentials Short Sleeve T-Shirt - Men's,MEC,32.95,0,4,4,clothing,2020-10-17
Patagonia Terrebonne Joggers - Men's,Patagonia,99,0,4,1,clothing,2020-10-17
Black Diamond Guide Gloves - Men's,Black Diamond,194.95,0,4,27,clothing,2020-10-17
Showers Pass Atlas Jacket - Men's,Showers Pass,394.95,0,4.7,18,clothing,2020-10-17
Brooks Distance Long Sleeve Top - Men's,Brooks,43.95,0,4.9,19,clothing,2020-10-17
MEC In-Flight Pants - Men's,MEC,79.95,0,4.3,3,clothing,2020-10-17
Vuori Ponto Performance Pants - Men's,Vuori,104.95,0,5,1,clothing,2020-10-17
Smartwool Merino 250 Baselayer Colorblock Long Sleeve Crew - Men's,Smartwool,139.95,0,0,0,clothing,2020-10-17
MEC T1 Long Johns - Men's,MEC,24.95,0,4.2,8,clothing,2020-10-17
Arc'teryx Atom AR Hoody - Men's,Arc'teryx,369.95,0,4.7,125,clothing,2020-10-17
Patagonia 3-in-1 Snowshot Jacket - Men's,Patagonia,349.3,30,3,2,clothing,2020-10-17
Brooks Dash Half Zip Long Sleeve Top - Men's,Brooks,69.95,0,4.5,13,clothing,2020-10-17
MEC Transference Reversible Down Jacket - Men's,MEC,79.98,68,3.3,7,clothing,2020-10-17
Arc'teryx Russet Pants - Men's,Arc'teryx,159.95,0,4.3,7,clothing,2020-10-17
MEC Overland Stretch Shirt - Men's,MEC,74.95,0,3.7,3,clothing,2020-10-17
MEC Core Train Short Sleeve T-Shirt - Men's,MEC,39.95,0,4.6,8,clothing,2020-10-17
Auclair Abner Double Knit Gloves - Men's,Auclair,19.95,0,0,0,clothing,2020-10-17
Sportful Reflex Jacket - Men's,Sportful,69.95,0,2.2,6,clothing,2020-10-17
MEC RnB Shorts - Men's,MEC,35.98,52,5,2,clothing,2020-10-17
Arc'teryx Sabre AR Gore-Tex Pants - Men's,Arc'teryx,599.95,30,4.6,9,clothing,2020-10-17
Patagonia R1 Pullover Hoody - Men's,Patagonia,199,0,5,1,clothing,2020-10-17
Tentree Juniper Classic T-Shirt - Men's,Tentree,39.95,0,0,0,clothing,2020-10-17
The North Face Sprag 5-Pocket Pants - Men's,The North Face,71.97,20,0,0,clothing,2020-10-17
"Prana Brion Pants 30"" Inseam - Men's",Prana,71.97,39,5,2,clothing,2020-10-17
Prana Zion Chino Pants - Men's,Prana,79.97,20,0,0,clothing,2020-10-17
MEC Trax Nordic Soft Shell Vest - Men's,MEC,99.95,35,0,0,clothing,2020-10-17
Salomon Agile Warm Tights - Men's,Salomon,119.95,0,4.7,3,clothing,2020-10-17
Sportful Cardio Tech Jersey - Men's,Sportful,89.93,50,4,1,clothing,2020-10-17
MEC Northlink Parka - Men's,MEC,229.95,0,0,0,clothing,2020-10-17
Patagonia Down Sweater Hoody - Men's,Patagonia,349,0,5,3,clothing,2020-10-17
Arc'teryx Aptin Shorts - Men's,Arc'teryx,99.95,50,4.6,24,clothing,2020-10-17
Prana Ulterior Slim Pants - Men's,Prana,87.97,20,0,0,clothing,2020-10-17
Baro Drywear The Manning Jacket - Men's,Baro Drywear,347.95,0,0,0,clothing,2020-10-17
Arc'teryx Bernal Long Sleeve Shirt - Men's,Arc'teryx,129.95,0,4.5,14,clothing,2020-10-17
Kuhl Revel 1/4 Zip - Men's,Kuhl,99.95,0,5,1,clothing,2020-10-17
Smartwool Intraknit Merino 250 Thermal 1/4 Zip Top - Men's,Smartwool,189.95,0,0,0,clothing,2020-10-17
Arc'teryx Kaslo Long Sleeve Shirt - Men's,Arc'teryx,119.95,0,3,2,clothing,2020-10-17
Patagonia Fjord Flannel Shirt - Men's,Patagonia,109,0,4.8,11,clothing,2020-10-17
Patagonia Straight Fit Cords - Men's,Patagonia,109,0,0,0,clothing,2020-10-17
Patagonia Houdini Air Jacket - Men's,Patagonia,209,0,5,1,clothing,2020-10-17
MEC Classic Short Sleeve T-shirt - Men's,MEC,17.95,0,3.3,14,clothing,2020-10-17
Patagonia Venga Rock Pants - Men's,Patagonia,76.3,30,3,3,clothing,2020-10-17
Showers Pass Transit Pants - Men's,Showers Pass,149.95,0,4.5,60,clothing,2020-10-17
MEC Mica 2 Shorts - Men's,MEC,69.95,51,3.6,8,clothing,2020-10-17
Phelps Pursuit 2.0 Triathlon Wetsuit - Men's,Phelps,299.95,0,3,1,clothing,2020-10-17
"DU/ER Performance Denim Slim Pants (32"" Inseam) - Men's",DU/ER,139.95,0,5,9,clothing,2020-10-17
Fjallraven Greenland Winter Jacket - Men's,Fjallraven,399.95,0,3,2,clothing,2020-10-17
Arc'teryx Gamma LT Pants - Men's,Arc'teryx,199.95,20,4.5,108,clothing,2020-10-17
MEC RnB Pants - Men's,MEC,79.95,0,3,2,clothing,2020-10-17
Vuori Ponto Performance Pullover - Men's,Vuori,135.95,0,0,0,clothing,2020-10-17
Patagonia P-6 Logo Long Sleeve Responsibili-Tee - Men's,Patagonia,55,0,0,0,clothing,2020-10-17
Fjallraven High Coast Lite Sweater - Men's,Fjallraven,119.95,0,0,0,clothing,2020-10-17
Xcel Signature Ventx Long Sleeve - Men's,Xcel,37.94,31,4.5,4,clothing,2020-10-17
Black Diamond Notion Shorts - Men's,Black Diamond,84.95,41,4,4,clothing,2020-10-17
MEC Sun Dodger Short Sleeve Hiking Shirt - Men's,MEC,24.94,64,3.7,7,clothing,2020-10-17
DU/ER No Sweat Pants Slim - Men's,DU/ER,138.95,0,3,2,clothing,2020-10-17
MEC Mochilero Shorts - Men's,MEC,64.95,0,4.6,5,clothing,2020-10-17
The North Face Tekno Ridge Hoodie - Men's,The North Face,99.93,38,4,1,clothing,2020-10-17
The North Face Paramount Active Convertible Pants - Men's,The North Face,79.97,20,0,0,clothing,2020-10-17
Patagonia Performance Twill Jeans - Men's,Patagonia,125,0,2.4,5,clothing,2020-10-17
Smartwool Merino 150 Boxer Briefs - Men's,Smartwool,59.95,0,3.4,38,clothing,2020-10-17
The North Face Goldmill Parka - Men's,The North Face,349.99,0,5,1,clothing,2020-10-17
BN3TH Classic Boxer Briefs - Men's,BN3TH,34.95,0,5,3,clothing,2020-10-17
The North Face Dryzzle Futurelight Jacket - Men's,The North Face,279.99,0,5,2,clothing,2020-10-17
Arc'teryx Cormac Logo Short Sleeve Tee - Men's,Arc'teryx,74.95,0,5,3,clothing,2020-10-17
Vuori Strato Tech T-Shirt - Men's,Vuori,53.95,0,0,0,clothing,2020-10-17
Black Diamond Chalked Up T-Shirt - Men's,Black Diamond,38.95,0,2.6,5,clothing,2020-10-17
Patagonia Insulated Quandary Jacket - Men's,Patagonia,375,0,5,1,clothing,2020-10-17
Prana Prevailor Long Sleeve - Men's,Prana,59.97,20,0,0,clothing,2020-10-17
MEC Peak Comfort AirGrid Lite Short Sleeve Base Layer - Men's,MEC,29.95,0,0,0,clothing,2020-10-17
Race Face Agent Winter Pants - Men's,Race Face,189.95,0,1,1,clothing,2020-10-17
Houdini Daybreak Jacket - Men's,Houdini,149.93,50,0,0,clothing,2020-10-17
Patagonia Micro D Snap-T Pullover - Men's,Patagonia,109,0,5,1,clothing,2020-10-17
Patagonia Back Step Shirt - Men's,Patagonia,85,0,5,1,clothing,2020-10-17
Patagonia Quandary Convertible Pants - Men's,Patagonia,109,0,4.7,3,clothing,2020-10-17
Smartwool Merino 150 Pocket Tee - Men's,Smartwool,99.95,0,0,0,clothing,2020-10-17
"MEC All Day Essentials Boxer Briefs 3"" - Men's",MEC,24.95,0,5,2,clothing,2020-10-17
Level Six Jericho Long Sleeve Neoprene Rashguard - Men's,Level Six,99.95,0,5,1,clothing,2020-10-17
Prana Rockland Pants - Men's,Prana,57.94,50,5,4,clothing,2020-10-17
MEC Cold Rush Thermal Run Tights - Men's,MEC,84.95,0,5,1,clothing,2020-10-17
Patagonia Fitz Roy Bear Trucker Hat - Men's,Patagonia,45,0,5,1,clothing,2020-10-17
"DU/ER Performance Denim Slim Pants (30"" Inseam) - Men's",DU/ER,138.95,0,3.3,7,clothing,2020-10-17
MEC Chilcotins Short Sleeve Utility Shirt - Men's,MEC,30.94,61,0,0,clothing,2020-10-17
DU/ER Performance Denim Slim - Men's,DU/ER,138.95,0,0,0,clothing,2020-10-17
"Prana Bridger Jeans 30"" Inseam - Men's",Prana,87.97,20,4,2,clothing,2020-10-17
The North Face Paramount Active Pants - Men's,The North Face,39.93,56,4.1,7,clothing,2020-10-17
The North Face Dome Climb Short Sleeve T-Shirt - Men's,The North Face,27.97,20,5,1,clothing,2020-10-17
Arc'teryx Arc'word Short Sleeve T-Shirt - Men's,Arc'teryx,44.95,0,4.5,22,clothing,2020-10-17
Smartwool Smartloft 120 Jacket - Men's,Smartwool,153.57,36,0,0,clothing,2020-10-17
MEC Mochilero Stretch Lined Pants - Men's,MEC,119.95,0,0,0,clothing,2020-10-17
Fjallraven Fjallraven Logo Short Sleeve T-Shirt - Men's,Fjallraven,49.95,0,0,0,clothing,2020-10-17
Tentree Elm Cotton Classic T-Shirt - Men's,Tentree,35.95,0,3,1,clothing,2020-10-17
"Patagonia Essential 6"" Boxer Briefs - Men's",Patagonia,39,0,5,1,clothing,2020-10-17
Fjallraven Abisko Trail Fleece - Men's,Fjallraven,179.95,0,0,0,clothing,2020-10-17
MEC Mochilero Stretch Lined Pants - Men's,MEC,60.93,49,4,6,clothing,2020-10-17
The North Face Thermoball Eco Jacket - Men's,The North Face,249.99,0,0,0,clothing,2020-10-17
Arc'teryx Nuclei FL Hoody - Men's,Arc'teryx,349.95,0,4.7,18,clothing,2020-10-17
Prana Super Mojo Shorts II - Men's,Prana,55.97,20,4,5,clothing,2020-10-17
Levis 502 Regular Taper Pants - Men's,Levis,99.95,0,5,1,clothing,2020-10-17
Karpos Tre Cime Pants - Men's,Karpos,79.94,50,0,0,clothing,2020-10-17
Fjallraven Abisko Midsummer Trousers - Men's,Fjallraven,179.95,0,3.5,2,clothing,2020-10-17
"Patagonia Snowshot Pants Regular 32""Inseam - Men's",Patagonia,174.3,30,4,1,clothing,2020-10-17
Patagonia Terrebonne Shorts - Men's,Patagonia,55.3,30,0,0,clothing,2020-10-17
Saxx Kinetic HD Boxer Brief - Men's,Saxx,39.95,0,0,0,clothing,2020-10-17
Patagonia Houdini Jacket - Men's,Patagonia,125,0,5,4,clothing,2020-10-17
Chaos Dylan Trapper Hat - Men's,Chaos,34.95,0,4.2,13,clothing,2020-10-17
Stance Polycam Crew Run Socks - Men's,Stance,19.94,31,0,0,clothing,2020-10-17
Auclair Run For Cover Gloves - Men's,Auclair,24.95,0,3,1,clothing,2020-10-17
Patagonia Light Storm Jacket - Men's,Patagonia,220.5,30,0,0,clothing,2020-10-17
Odlo Blackcomb Pro Crew Neck Short Sleeve - Men's,Odlo,35.93,55,5,1,clothing,2020-10-17
Prana Calder Long Sleeve Top - Men's,Prana,48.94,30,5,1,clothing,2020-10-17
The North Face Mountain Sweatshirt 3.0 Anorak - Men's,The North Face,86.93,49,0,0,clothing,2020-10-17
The North Face 1996 Retro Nuptse Vest - Men's,The North Face,249.99,0,0,0,clothing,2020-10-17
Patagonia Skyline Traveler Pants - Men's,Patagonia,149,0,0,0,clothing,2020-10-17
Arc'teryx Squamish Hoody - Men's,Arc'teryx,199.95,0,4.7,93,clothing,2020-10-17
BN3TH Classic Boxer Briefs (2 Pack) - Men's,BN3TH,64.95,0,3.3,3,clothing,2020-10-17
Houdini Heavenly Houdi Jacket - Men's,Houdini,199.93,50,0,0,clothing,2020-10-17
Smartwool Merino Sport Ultra Light Hoodie - Men's,Smartwool,149.95,0,3,1,clothing,2020-10-17
Levis 541 Athletic Taper Pants - Men's,Levis,89.95,0,0,0,clothing,2020-10-17
Vuori Outdoor Trainer Shell - Men's,Vuori,139.95,0,5,1,clothing,2020-10-17
Black Diamond Notion Pants - Men's,Black Diamond,94.95,51,4.4,27,clothing,2020-10-17
Brooks Distance Short Sleeve T-Shirt - Men's,Brooks,33.95,0,4.4,30,clothing,2020-10-17
Auclair Avalon Ragwool Flip Mitts - Men's,Auclair,34.95,0,3.8,9,clothing,2020-10-17
Arc'teryx Sawyer Gore-Tex Coat - Men's,Arc'teryx,599.95,0,3.8,20,clothing,2020-10-17
Patagonia P-6 Logo Trucker Hat - Men's,Patagonia,31.5,30,3.2,5,clothing,2020-10-17
MEC Below Celsius Insulated Pants - Men's,MEC,189.95,0,2.7,9,clothing,2020-10-17
Cotopaxi Parque Stretch Rain Shell - Men's,Cotopaxi,99.93,50,5,1,clothing,2020-10-17
The North Face Temescal Travel Jacket - Men's,The North Face,79.94,50,0,0,clothing,2020-10-17
Vuori Kore Shorts - Men's,Vuori,84.95,0,5,1,clothing,2020-10-17
Auclair Pacer Run Gloves - Men's,Auclair,29.95,0,1,1,clothing,2020-10-17
MEC Mochilero Stretch Pants - Men's,MEC,36.93,54,3.9,31,clothing,2020-10-17
Arc'teryx Fraser Jacket - Men's,Arc'teryx,549.95,0,4.8,5,clothing,2020-10-17
MEC Stradale Jacket - Men's,MEC,89.93,54,3.9,16,clothing,2020-10-17
Kuhl Radikl Pants - Men's,Kuhl,99.95,0,0,0,clothing,2020-10-17
BN3TH Classic Trunks - Men's,BN3TH,34.95,0,0,0,clothing,2020-10-17
Patagonia Capilene Midweight Zip Neck Top - Men's,Patagonia,85,0,4.8,4,clothing,2020-10-17
Vuori Ponto Shorts - Men's,Vuori,94.95,0,0,0,clothing,2020-10-17
Kombi P1 Liner Glove - Men's,Kombi,19.95,0,0,0,clothing,2020-10-17
Patagonia Live Simply Guitar Responsibili T-Shirt - Men's,Patagonia,45,0,3,2,clothing,2020-10-17
"Prana Ulterior Shorts 9"" Inseam - Men's",Prana,63.97,44,0,0,clothing,2020-10-17
MEC Rad Pants - Men's,MEC,89.95,0,3.9,40,clothing,2020-10-17
MEC Sandbagger Pants - Men's,MEC,61.58,55,3.9,55,clothing,2020-10-17
Patagonia Pack In Jacket - Men's,Patagonia,157.5,30,0,0,clothing,2020-10-17
United By Blue Standard Chino - Men's,United,37.93,56,0,0,clothing,2020-10-17
Smartwool Merino 150 Print Boxer Briefs - Men's,Smartwool,59.95,0,0,0,clothing,2020-10-17
Vuori Transit Joggers - Men's,Vuori,109.95,0,0,0,clothing,2020-10-17
Fjallraven High Coast Lite Trousers - Men's,Fjallraven,149.95,0,3,2,clothing,2020-10-17
Smartwool Spruce Street Crew Socks - Men's,Smartwool,26.95,0,4.8,24,clothing,2020-10-17
Rab Nexus Jacket - Men's,Rab,139.95,0,0,0,clothing,2020-10-17
Xcel Heathered VentX Island Tapa Band Long Sleeve - Men's,Xcel,41.94,30,0,0,clothing,2020-10-17
"Patagonia Baggies 7"" Shorts - Men's",Patagonia,69,0,3.6,5,clothing,2020-10-17
Patagonia R2 TechFace Jacket - Men's,Patagonia,209,0,5,1,clothing,2020-10-17
The North Face North Dome Short Sleeve Shirt - Men's,The North Face,44.93,50,5,1,clothing,2020-10-17
MEC Stelvio Rain Jacket - Men's,MEC,125.98,44,4.2,9,clothing,2020-10-17
"DU/ER Adventure Pants (30"" Inseam) - Men's",DU/ER,69.93,53,3,1,clothing,2020-10-17
Prana Sander Boardshorts - Men's,Prana,55.94,30,0,0,clothing,2020-10-17
Arc'teryx Atom SL Hoody - Men's,Arc'teryx,179.94,31,4.7,98,clothing,2020-10-17
Fjallraven Abisko Lite Shorts - Men's,Fjallraven,134.95,0,0,0,clothing,2020-10-17
Brooks Ghost Short Sleeve T-Shirt - Men's,Brooks,39.95,0,3.9,15,clothing,2020-10-17
NRS Hydroskin 0.5mm Long Sleeve Shirt - Men's,NRS,132.95,0,0,0,clothing,2020-10-17
Billabong Surftrek Wick Shorts - Men's,Billabong,41.93,40,4.5,4,clothing,2020-10-17
The North Face Cypress Jacket - Men's,The North Face,124.93,41,1,1,clothing,2020-10-17
"Prana Furrow Shorts 11"" Inseam - Men's",Prana,59.97,20,5,3,clothing,2020-10-17
Fjallraven 1960 Logo Tee - Men's,Fjallraven,49.95,0,0,0,clothing,2020-10-17
Swany Gore Winterfall Gloves - Men's,Swany,119.95,0,0,0,clothing,2020-10-17
MEC Hydrofoil Stretch Pants - Men's,MEC,64.95,48,3.4,7,clothing,2020-10-17
Patagonia Line Logo Ridge Pocket Responsibili T-Shirt - Men's,Patagonia,49,0,0,0,clothing,2020-10-17
Patagonia Cap Cool Trail Bike Henley - Men's,Patagonia,48.3,30,0,0,clothing,2020-10-17
Black Diamond Circuit Pants - Men's,Black Diamond,56.93,52,4.8,6,clothing,2020-10-17
The North Face Flight Futurelight Jacket - Men's,The North Face,303.97,20,0,0,clothing,2020-10-17
Stance Jimmy Chin Altitude Hike Crew Socks - Men's,Stance,35.95,0,0,0,clothing,2020-10-17
Patagonia How to Help Organic T-Shirt - Men's,Patagonia,45,0,0,0,clothing,2020-10-17
Picture Abstral Jacket - Men's,Picture,109.93,45,0,0,clothing,2020-10-17
Prana Prevailor Shirt - Men's,Prana,51.97,20,0,0,clothing,2020-10-17
"Prana Brion Shorts 9"" Inseam - Men's",Prana,59.97,20,5,6,clothing,2020-10-17
Smartwool Merino 150 Baselayer Short Sleeve - Men's,Smartwool,94.95,0,0,0,clothing,2020-10-17
Patagonia Organic Cotton Slub Poplin Shirt - Men's,Patagonia,75,0,0,0,clothing,2020-10-17
The North Face Freedom Insulated Pants - Men's,The North Face,199.99,0,0,0,clothing,2020-10-17
The North Face Cuchillo Insulated Vest - Men's,The North Face,169.99,0,3,1,clothing,2020-10-17
Fjallraven Expedition Pack Down Hoodie - Men's,Fjallraven,349.95,0,0,0,clothing,2020-10-17
Patagonia Sol Patrol II Long Sleeve Shirt - Men's,Patagonia,99,0,4.6,5,clothing,2020-10-17
Patagonia Micro Puff Jacket - Men's,Patagonia,315,30,4.2,4,clothing,2020-10-17
Patagonia Cotton Quilt Snap-T Pullover - Men's,Patagonia,189,0,0,0,clothing,2020-10-17
The North Face Fort Point Flannel Shirt - Men's,The North Face,159.99,0,0,0,clothing,2020-10-17
MEC All Day Essentials Boxers - Men's,MEC,24.95,0,3.2,4,clothing,2020-10-17
