,Brand,Current_price,Discount,Avg_review_outof5,Num_reviews,Product_category,Date_retrieved
Vuori Ease Performance Half Zip Top - Men's,Vuori,93.95,0,0,0,clothing,2020-10-17
Houdini Big Up Message T-shirt - Men's,Houdini,36.94,51,0,0,clothing,2020-10-17
MEC Mochilero Stretch Convertible Pants - Men's,MEC,43.93,51,3.1,20,clothing,2020-10-17
Fjallraven Abisko Trekking Shirt - Men's,Fjallraven,144.95,0,5,1,clothing,2020-10-17
The North Face HyperLayer FD Short Sleeve Crew - Men's,The North Face,39.97,20,0,0,clothing,2020-10-17
Showers Pass IMBA Jacket - Men's,Showers Pass,249.95,0,4.7,24,clothing,2020-10-17
Fjallraven Abisko Shorts - Men's,Fjallraven,139.95,0,5,2,clothing,2020-10-17
NRS Hydroskin 0.5mm Jacket - Men's,NRS,152.95,0,0,0,clothing,2020-10-17
Rab Kaon Jacket - Men's,Rab,299.95,0,5,1,clothing,2020-10-17
Kombi Timeless Gloves - Men's,Kombi,94.95,0,2,5,clothing,2020-10-17
"Smartwool Merino Sport Lined 8"" Shorts - Men's",Smartwool,84.95,0,0,0,clothing,2020-10-17
"MEC All Day Essentials Boxer Briefs 5"" - Men's",MEC,24.95,0,3,2,clothing,2020-10-17
Cotopaxi Do Good Long Sleeve Crew - Men's,Cotopaxi,79.95,0,0,0,clothing,2020-10-17
Smartwool Merino Sport 150 Briefs - Men's,Smartwool,34.95,0,3,4,clothing,2020-10-17
MEC Core Train Tank - Men's,MEC,39.95,0,0,0,clothing,2020-10-17
Rab Borealis Jacket - Men's,Rab,144.95,0,0,0,clothing,2020-10-17
Patagonia Organic Cotton Gi Pants - Men's,Patagonia,125,0,5,1,clothing,2020-10-17
Fjallraven Greenland No.1 Special Edition Jacket - Men's,Fjallraven,349.95,0,5,1,clothing,2020-10-17
B Daehlie Ridge Full Zip Pants - Men's,B Daehlie,119.95,0,5,1,clothing,2020-10-17
The North Face ThermoBall Pullover - Men's,The North Face,259.99,0,5,1,clothing,2020-10-17
Patagonia Cotton in Conversion T-Shirt - Men's,Patagonia,49,0,0,0,clothing,2020-10-17
Black Diamond Live Climb Repeat T-Shirt - Men's,Black Diamond,24.94,36,0,0,clothing,2020-10-17
MEC Gorp Hike Shorts - Men's,MEC,44.95,0,4.5,4,clothing,2020-10-17
Stance Combat Crew Socks - Men's,Stance,22.5,0,0,0,clothing,2020-10-17
Patagonia Capilene Cool Daily Long Sleeve Graphic T-Shirt - Men's,Patagonia,69,0,0,0,clothing,2020-10-17
MEC Transfer Reflect Shorts - Men's,MEC,64.95,0,5,3,clothing,2020-10-17
Prana Journeyman Trucker Hat - Men's,Prana,39,23,4.3,3,clothing,2020-10-17
Patagonia Lightweight All-Wear Hemp Coaches Jacket - Men's,Patagonia,111.3,30,0,0,clothing,2020-10-17
Odlo Performance Light Crew Neck Short Sleeve Baselayer - Men's,Odlo,31.93,54,0,0,clothing,2020-10-17
Prana Hardesty Shirt - Men's,Prana,39.97,20,5,2,clothing,2020-10-17
Patagonia Isthmus Quilted Shirt Jacket - Men's,Patagonia,209,0,5,2,clothing,2020-10-17
Picture Object Jacket - Men's,Picture,214.37,36,4,1,clothing,2020-10-17
Patagonia Insulated Fjord Flannel Jacket - Men's,Patagonia,209,30,0,0,clothing,2020-10-17
Black Diamond Super Light Mitts - Men's,Black Diamond,199.95,0,4.5,2,clothing,2020-10-17
Vuori Stockton Shorts - Men's,Vuori,89.95,0,5,1,clothing,2020-10-17
The North Face Montana Futurelight Etip Mitts - Men's,The North Face,89.99,0,0,0,clothing,2020-10-17
Arc'teryx Solano Hoody - Men's,Arc'teryx,189.94,32,4,13,clothing,2020-10-17
The North Face Deptford Down Jacket - Men's,The North Face,194.93,50,5,1,clothing,2020-10-17
Pistil Dusk Cap - Men's,Pistil,34.95,0,0,0,clothing,2020-10-17
Arc'teryx Kestros Pants - Men's,Arc'teryx,149.95,0,4.6,18,clothing,2020-10-17
Sportful Ride 15 Socks - Men's,Sportful,29.95,0,0,0,clothing,2020-10-17
Kombi P3 Touch Screen Liner Glove - Men's,Kombi,29.95,0,0,0,clothing,2020-10-17
Brooks Stealth Short Sleeve T-Shirt - Men's,Brooks,45.95,0,4.2,13,clothing,2020-10-17
Patagonia Organic Cotton Lightweight Polo - Men's,Patagonia,75,0,0,0,clothing,2020-10-17
TYR Hexa All Over Jammer Swimsuit - Men's,TYR,44.95,0,5,1,clothing,2020-10-17
Patagonia Capilene Air Crew - Men's,Patagonia,159,0,5,2,clothing,2020-10-17
Wigwam Peak to Pub Gift Box - Men's,Wigwam,48.95,0,0,0,clothing,2020-10-17
Prana Prevailor Tank - Men's,Prana,39.94,33,0,0,clothing,2020-10-17
The North Face Montana Futurelight Etip Gloves - Men's,The North Face,89.99,0,5,2,clothing,2020-10-17
Patagonia Recycled Wool Sweater - Men's,Patagonia,159,0,0,0,clothing,2020-10-17
Patagonia Torrentshell 3 Layer Pullover - Men's,Patagonia,159,0,0,0,clothing,2020-10-17
Prana Vaha Shorts - Men's,Prana,59.97,20,5,1,clothing,2020-10-17
Mammut Aconcagua Midlayer Jacket - Men's,Mammut,153.27,30,0,0,clothing,2020-10-17
Arc'teryx Remige Word Short Sleeve Shirt - Men's,Arc'teryx,64.95,0,3.8,4,clothing,2020-10-17
Arc'teryx Cormac Short Sleeve Crew - Men's,Arc'teryx,79.95,0,4.6,32,clothing,2020-10-17
BN3TH Hero Knit Boxer Brief - Men's,BN3TH,42.95,0,0,0,clothing,2020-10-17
Patagonia Better Sweater Henley Pullover - Men's,Patagonia,149,0,0,0,clothing,2020-10-17
Vuori Tradewind Performance T-Shirt - Men's,Vuori,60,0,0,0,clothing,2020-10-17
Houdini Crux Shorts - Men's,Houdini,59.93,54,0,0,clothing,2020-10-17
Prana Brigg Hoodie - Men's,Prana,55.98,44,0,0,clothing,2020-10-17
The North Face Active Trail Hybrid Joggers - Men's,The North Face,129.99,0,0,0,clothing,2020-10-17
Houdini Daybreak Pullover - Men's,Houdini,129.93,50,0,0,clothing,2020-10-17
Patagonia Causey Pike Pants - Men's,Patagonia,149,0,0,0,clothing,2020-10-17
Kombi P2 Blend Merino Liner Glove - Men's,Kombi,21.95,0,0,0,clothing,2020-10-17
Houdini Daybreak Shorts - Men's,Houdini,99.93,47,5,1,clothing,2020-10-17
Pearl Izumi Rove Shirt - Men's,Pearl Izumi,99.95,0,0,0,clothing,2020-10-17
Levis 511 Slim Fit Pants - Men's,Levis,118,0,0,0,clothing,2020-10-17
Ear Podz Buffalo Plaid Earwarmer - Men's,Ear Podz,19,0,0,0,clothing,2020-10-17
NRS Hydroskin 0.5mm Shorts - Men's,NRS,92.95,0,0,0,clothing,2020-10-17
Black Diamond Chalked Up Tank - Men's,Black Diamond,34.95,0,0,0,clothing,2020-10-17
Houdini Long Sleeve Cover Crew - Men's,Houdini,89.93,36,0,0,clothing,2020-10-17
DU/ER No Sweat Shorts - Men's,DU/ER,83.95,0,5,1,clothing,2020-10-17
Prana Cayman Shirt - Men's,Prana,63.97,20,5,2,clothing,2020-10-17
Stance Conflicted Quarter Run Socks - Men's,Stance,28.95,0,5,1,clothing,2020-10-17
Picture Newport Hoodie - Men's,Picture,114.95,0,0,0,clothing,2020-10-17
Chaos Bill Scarf - Men's,Chaos,20.93,46,0,0,clothing,2020-10-17
Prana Calder Short Sleeve Top - Men's,Prana,59.95,0,0,0,clothing,2020-10-17
TYR Solid Jammer - Men's,TYR,39.95,0,0,0,clothing,2020-10-17
Smartwool Merino Sport 150 Boxer Briefs - Men's,Smartwool,44.95,0,0,0,clothing,2020-10-17
Adidas Alphaskin Parley 3/4 Tights - Men's,Adidas,38.38,52,0,0,clothing,2020-10-17
Kombi Re-Knit Liner Glove - Men's,Kombi,34.95,0,0,0,clothing,2020-10-17
TYR Hexa All Over Racer Swimsuit - Men's,TYR,32.95,0,4,1,clothing,2020-10-17
Arc'teryx Norvan SL Insulated Gore-Tex Hoody - Men's,Arc'teryx,549.95,0,4.3,22,clothing,2020-10-17
Arc'teryx Incendo SL Jacket - Men's,Arc'teryx,111.94,30,4.4,12,clothing,2020-10-17
Arc'teryx Zeta SL Gore-Tex Pants - Men's,Arc'teryx,299.95,0,4.3,10,clothing,2020-10-17
Level Six Pro Guide Neoprene Lined Boardshorts - Men's,Level Six,89.95,0,4.5,6,clothing,2020-10-17
MEC Ferrata Pants - Men's,MEC,129.95,0,4.5,6,clothing,2020-10-17
MEC Highpoint Pants - Men's,MEC,39.98,60,4,5,clothing,2020-10-17
The North Face 1996 Retro Nuptse Jacket - Men's,The North Face,349.99,0,5,1,clothing,2020-10-17
Patagonia Woolyester Fleece Jacket - Men's,Patagonia,179,0,5,1,clothing,2020-10-17
Fjallraven Raven Jacket - Men's,Fjallraven,274.95,0,5,1,clothing,2020-10-17
"Kuhl Renegade 10"" Shorts - Men's",Kuhl,94.95,0,5,1,clothing,2020-10-17
Patagonia R1 Pullover - Men's,Patagonia,159,0,5,1,clothing,2020-10-17
Saxx Sleepwalker PJ Pants - Men's,Saxx,69.95,0,5,1,clothing,2020-10-17
Patagonia Venga Rock Knickers - Men's,Patagonia,63,30,4,2,clothing,2020-10-17
Level Six Coastal Long Sleeve Sunguard - Men's,Level Six,41.93,30,4,2,clothing,2020-10-17
Lenz Heat Gloves 4.0 (Batteries Sold Separately) - Men's,Lenz,289.95,0,0,0,clothing,2020-10-17
Level Six Jericho Short Sleeve Rashguard - Men's,Level Six,62.97,30,0,0,clothing,2020-10-17
Rab Kinetic Plus Jacket - Men's,Rab,299.95,0,0,0,clothing,2020-10-17
The North Face Printed Cyclone Hoodie - Men's,The North Face,99.99,0,0,0,clothing,2020-10-17
Kuhl Renegade Pants - Men's,Kuhl,104.95,0,0,0,clothing,2020-10-17
Patagonia Scallop Hem Stretch Wavefarer 18in Boardshorts - Men's,Patagonia,85,0,0,0,clothing,2020-10-17
The North Face A-Cad Jacket - Men's,The North Face,779.99,0,0,0,clothing,2020-10-17
Vuori Sunday Performance Joggers - Men's,Vuori,109.95,0,0,0,clothing,2020-10-17
The North Face Unlimited Jacket - Men's,The North Face,399.99,0,0,0,clothing,2020-10-17
Patagonia Galvanized Jacket - Men's,Patagonia,435,0,0,0,clothing,2020-10-17
Mustang Survival Callan Jacket - Men's,Mustang Survival,379.99,0,0,0,clothing,2020-10-17
Arc'teryx Rush Gore-Tex Jacket - Men's,Arc'teryx,559.97,30,0,0,clothing,2020-10-17
Pearl Izumi Rove Long Sleeve Shirt - Men's,Pearl Izumi,139.95,0,0,0,clothing,2020-10-17
Picture Takashima Jacket - Men's,Picture,140.77,36,0,0,clothing,2020-10-17
Speedo Poly Jammer - Men's,Speedo,49.95,0,0,0,clothing,2020-10-17
MEC Trek Pants - Men's,MEC,69.95,0,0,0,clothing,2020-10-17
Kombi The Timber Glove - Men's,Kombi,49.95,0,0,0,clothing,2020-10-17
Baro Drywear The Quarry Jacket - Men's,Baro Drywear,223.95,0,0,0,clothing,2020-10-17
Picture Shari Tech Hoodie - Men's,Picture,144.95,0,0,0,clothing,2020-10-17
Picture Larson Tech Hoodie - Men's,Picture,149.95,0,0,0,clothing,2020-10-17
The North Face Arque Jacket - Men's,The North Face,299.99,0,0,0,clothing,2020-10-17
Patagonia Diamond Quilted Bomber Hoody - Men's,Patagonia,209,0,0,0,clothing,2020-10-17
Fjallraven Abisko Midsummer Jacket - Men's,Fjallraven,259.95,0,0,0,clothing,2020-10-17
Tentree Cotton Short Sleeve Button Up Shirt - Men's,Tentree,73.95,0,0,0,clothing,2020-10-17
Rab Calient Pants - Men's,Rab,129.95,0,0,0,clothing,2020-10-17
The North Face Thermoball Eco Vest - Men's,The North Face,199.99,0,0,0,clothing,2020-10-17
The North Face Thermoball Eco Hoodie - Men's,The North Face,279.99,0,0,0,clothing,2020-10-17
Rab Cirrus Flex Vest - Men's,Rab,174.95,0,0,0,clothing,2020-10-17
Rab Meridian Jacket - Men's,Rab,379.95,0,0,0,clothing,2020-10-17
Vuori Tuvalu T-Shirt - Men's,Vuori,55.95,0,0,0,clothing,2020-10-17
Vuori Fleet Pants - Men's,Vuori,139.95,0,0,0,clothing,2020-10-17
The North Face Active Trail Henley Long Sleeve Shirt - Men's,The North Face,84.99,0,0,0,clothing,2020-10-17
The North Face Mountain Pullover Sweatshirt - Men's,The North Face,169.99,0,0,0,clothing,2020-10-17
The North Face New Outerboroughs Jacket - Men's,The North Face,579.99,0,0,0,clothing,2020-10-17
Fjallraven Expedition Down Lite Hoodie - Men's,Fjallraven,649.95,0,0,0,clothing,2020-10-17
Smartwool Merino Sport 150 Polo - Men's,Smartwool,99.95,0,0,0,clothing,2020-10-17
Patagonia Tools For Revolution Responsibili T-Shirt - Men's,Patagonia,45,0,0,0,clothing,2020-10-17
Vuori Daybreak Windbreaker - Men's,Vuori,134.95,0,0,0,clothing,2020-10-17
Picture Goods Jacket - Men's,Picture,499.95,0,0,0,clothing,2020-10-17
Picture Track Jacket - Men's,Picture,424.95,0,0,0,clothing,2020-10-17
Levis 512 Slim Taper Jeans - Men's,Levis,107.95,0,0,0,clothing,2020-10-17
Picture Object Pants - Men's,Picture,249.95,0,0,0,clothing,2020-10-17
Swany Gore Winterfall Mitts - Men's,Swany,119.95,0,0,0,clothing,2020-10-17
Pistil Barlow Scarf - Men's,Pistil,39.95,0,0,0,clothing,2020-10-17
Patagonia Sender Boxers - Men's,Patagonia,35,0,3,1,clothing,2020-10-17
Patagonia Better Sweater Jacket - Men's,Patagonia,118.3,30,3.7,12,clothing,2020-10-17
Kombi Timeless Mitts - Men's,Kombi,94.95,0,2.5,6,clothing,2020-10-17
,Brand,Current_price,Discount,Avg_review_outof5,Num_reviews,Product_category,Date_retrieved
Keen Revel IV Mid Polar Waterproof Winter Boots - Men's,Keen,229.95,0,0,0,footwear,2020-10-17
Forsake Wilson Boots - Men's,Forsake,189.95,0,4.7,52,footwear,2020-10-17
"Xtratuf 15"" Rain Boots - Men's",Xtratuf,159.95,0,5,2,footwear,2020-10-17
UGG Cali Waterproof Sneakers - Men's,UGG,129.95,0,4.8,17,footwear,2020-10-17
Hoka One One Bondi 7 Road Running Shoes - Men's,Hoka,189.95,0,4.5,212,footwear,2020-10-17
Oboz Bridger Mid Bdry Hiking Shoes - Men's,Oboz,219.95,0,4.3,57,footwear,2020-10-17
Zamberlan Vioz GT Gore-Tex Backpacking Boots - Men's,Zamberlan,299.95,0,4.3,181,footwear,2020-10-17
Scarpa Kailash Trek Gore-Tex Hiking Boots - Men's,Scarpa,299.95,0,4.5,10,footwear,2020-10-17
Salomon Outbound Gore-Tex Light Trail Shoes - Men's,Salomon,139.95,0,4,40,footwear,2020-10-17
Oboz Sawtooth II Low B-Dry Waterproof Light Trail - Men's,Oboz,179.95,0,3.8,4,footwear,2020-10-17
Salomon X Ultra Mid 3 Gore-Tex Light Trail Shoes - Men's,Salomon,199.95,0,4.3,178,footwear,2020-10-17
Scarpa Kailash Plus Gore-Tex Backpacking Boots - Men's,Scarpa,339.95,0,4.5,13,footwear,2020-10-17
Keen Revel IV EXP Mid Polar Waterproof Winter Boot - Men's,Keen,199.95,0,0,0,footwear,2020-10-17
Salomon XA Pro 3D v8 Gore-Tex Trail Running Shoes - Men's,Salomon,199.95,0,4.6,28,footwear,2020-10-17
Zamberlan 309 Trail Lite Gore-Tex Hiking Boots - Men's,Zamberlan,249.95,0,5,9,footwear,2020-10-17
Keen Targhee III Low Waterproof Light Trail Shoes - Men's,Keen,179.95,0,3.7,6,footwear,2020-10-17
"Xtratuf 6"" Ankle Rain Boots - Men's",Xtratuf,109.95,0,3.8,6,footwear,2020-10-17
Hoka One One Speedgoat 4 Gore-Tex Trail Running Shoes - Men's,Hoka,199.95,0,4.5,36,footwear,2020-10-17
Keen Pyrenees Hiking Boots - Men's,Keen,219.95,60,3.8,10,footwear,2020-10-17
Salomon OUTline Gore-Tex Trail Shoes - Men's,Salomon,159.95,0,4.5,26,footwear,2020-10-17
Brooks Adrenaline GTS 20 Road Running Shoes - Men's,Brooks,135.97,20,4.5,930,footwear,2020-10-17
Teva Original Universal Sandals - Men's,Teva,65,0,4.7,2875,footwear,2020-10-17
Vasque St. Elias FG Gore-Tex Backpacking Boots - Men's,Vasque,239.95,0,4.6,18,footwear,2020-10-17
Merrell Moab 2 Waterproof Light Trail Shoes - Men's,Merrell,159.95,0,2.7,27,footwear,2020-10-17
Salomon Quest 4D 3 Gore-Tex Hiking Boots - Men's,Salomon,289.95,0,4.3,173,footwear,2020-10-17
Scarpa Mont Blanc Pro Mountaineering Boots - Men's,Scarpa,628.95,0,4,2,footwear,2020-10-17
La Sportiva Spire Gore-Tex Surround Light Trail Shoes - Men's,La Sportiva,209.95,0,4.6,16,footwear,2020-10-17
Scarpa Kinesis Pro Gore-Tex Backpacking Boots - Men's,Scarpa,419.95,0,4.1,9,footwear,2020-10-17
Salomon X Ultra Mid 2 CS Waterproof Winter Boots - Men's,Salomon,219.95,0,4.6,24,footwear,2020-10-17
Merrell Moab 2 Mid Waterproof Light Trail Shoes - Men's,Merrell,179.95,0,3.2,12,footwear,2020-10-17
Salomon X Ultra Mid CS Waterproof Winter Boots - Men's,Salomon,199.95,0,4.9,8,footwear,2020-10-17
Salomon Speedcross 5 Gore-Tex Trail Running Shoes - Men's,Salomon,199.95,0,4.9,41,footwear,2020-10-17
Keen Targhee II Mid Waterproof Light Trail Shoes - Men's,Keen,189.95,0,2.6,5,footwear,2020-10-17
Scarpa SL Active Backpacking Boots - Men's,Scarpa,389.95,0,4.4,10,footwear,2020-10-17
Merrell Moab 2 Vent Light Trail Shoes - Men's,Merrell,139.95,0,4.6,8,footwear,2020-10-17
Vasque Breeze AT Mid Gore-Tex Hiking Boots - Men's,Vasque,199.95,0,4,3,footwear,2020-10-17
Oboz Bridger Low Waterproof Light Trail Shoes - Men's,Oboz,189.95,0,4.5,20,footwear,2020-10-17
Arc'teryx Aerios FL Mid Gore-Tex Light Hiking Shoes - Men's,Arc'teryx,214.95,0,4.1,41,footwear,2020-10-17
Salomon Outline Mid Gore-Tex Trail Shoes - Men's,Salomon,179.95,0,4.3,26,footwear,2020-10-17
Zamberlan Tofane NW GT Backpacking Boots - Men's,Zamberlan,449.95,0,4.6,48,footwear,2020-10-17
Arc'teryx Acrux TR Gore-Tex Hiking Boots - Men's,Arc'teryx,339.95,0,4.2,20,footwear,2020-10-17
Oboz Sawtooth II Mid B-Dry Waterproof Light Trail Shoes - Men's,Oboz,199.95,0,4.2,4,footwear,2020-10-17
Scarpa ZG Lite Gore-Tex Hiking Boots - Men's,Scarpa,249.95,0,5,2,footwear,2020-10-17
Salomon OUTward Gore-Tex Hiking Boots - Men's,Salomon,229.95,0,3,3,footwear,2020-10-17
On Cloud Reflective Waterproof Road Running Shoes - Men's,On,179.95,0,5,2,footwear,2020-10-17
La Sportiva Nucleo High Gore-Tex Surround Light Trail Shoes - Men's,La Sportiva,249.95,0,4.3,32,footwear,2020-10-17
Arc'teryx Aerios FL Gore-Tex Light Hiking Shoes - Men's,Arc'teryx,199.95,0,4.1,31,footwear,2020-10-17
Kodiak Rhode II Waterproof Arctic Grip Insulated Boots - Men's,Kodiak,199.95,0,4,6,footwear,2020-10-17
Lowa Renegade Gore-Tex Mid Light Hiking Boots - Men's,Lowa,339.95,0,3.5,2,footwear,2020-10-17
La Sportiva Bushido II Trail Running Shoes - Men's,La Sportiva,149.95,0,4,30,footwear,2020-10-17
Arc'teryx Norvan LD 2 Gore-Tex Trail Running Shoes - Men's,Arc'teryx,219.95,0,4.1,11,footwear,2020-10-17
Hoka One One Speedgoat 4 Trail Running Shoes - Men's,Hoka,189.95,0,4.1,153,footwear,2020-10-17
La Sportiva Wildcat 2.0 Gore-Tex Trail Running Shoes - Men's,La Sportiva,174.95,0,4.4,17,footwear,2020-10-17
La Sportiva Stream Gore-Tex Surround Light Trail Shoes - Men's,La Sportiva,229.95,0,4.3,18,footwear,2020-10-17
Scarpa Moraine Gore-Tex Light Trail Shoes - Men's,Scarpa,219.95,0,1.5,4,footwear,2020-10-17
Timberland Mt Maddsen Chukka Shoes - Men's,Timberland,139.95,0,4.8,19,footwear,2020-10-17
Merrell Nova 2 Mid Waterproof Light Trail Shoes - Men's,Merrell,179.95,0,0,0,footwear,2020-10-17
Oboz Sypes Low Leather B-Dry Light Trail Shoes - Men's,Oboz,189.95,0,5,1,footwear,2020-10-17
Salomon Sense Ride 3 Gore-Tex Invisible Fit Trail Running Shoes - Men's,Salomon,199.95,0,4.1,7,footwear,2020-10-17
Oboz Arete Mid B-Dry Hiking Shoes - Men's,Oboz,199.95,0,4,2,footwear,2020-10-17
Oboz Arete Low B-Dry Light Trail Shoes - Men's,Oboz,174.95,0,0,0,footwear,2020-10-17
Salomon X Ultra 3 Gore-Tex Light Trail Shoes - Men's,Salomon,179.95,0,4.1,108,footwear,2020-10-17
Salomon Snowspike Waterproof Trail Running Shoes - Men's,Salomon,229.95,0,4.9,9,footwear,2020-10-17
Salomon Speedcross 5 Trail Running Shoes - Men's,Salomon,169.95,0,4.5,142,footwear,2020-10-17
Zamberlan 900 Rolle Evo 2 Gore-Tex Hiking Boots - Men's,Zamberlan,239.95,0,5,3,footwear,2020-10-17
Scarpa Crux Approach Shoes - Men's,Scarpa,179.95,0,3.6,8,footwear,2020-10-17
Salomon XA Pro 3D v8 Trail Running Shoes - Men's,Salomon,169.95,0,4.2,29,footwear,2020-10-17
Merrell Moab Adventure Lace Shoes - Men's,Merrell,159.95,0,3.7,3,footwear,2020-10-17
Hoka One One Bondi 6 Road Running Shoes - Men's,Hoka,189.95,20,4.6,1008,footwear,2020-10-17
Hoka One One Clifton 7 Road Running Shoes - Men's,Hoka,169.95,0,4.4,223,footwear,2020-10-17
Timberland Snowblades Waterproof Insulated Boots - Men's,Timberland,149.95,0,4.9,17,footwear,2020-10-17
Timberland Chillberg Tall Waterproof Insulated Boots - Men's,Timberland,169.95,0,4.2,85,footwear,2020-10-17
Oboz Sawtooth II Low Light Trail Shoes - Men's,Oboz,149.95,0,4,4,footwear,2020-10-17
Scarpa Charmoz Mountaineering Boots - Men's,Scarpa,379.95,0,5,2,footwear,2020-10-17
La Sportiva Nepal EVO Gore-Tex Mountaineering Boots - Men's,La Sportiva,629.95,0,3.7,3,footwear,2020-10-17
On Cloudventure Waterproof Trail Running Shoes - Men's,On,209.95,0,2,2,footwear,2020-10-17
Saucony Ride ISO 2 Road Running Shoes - Men's,Saucony,111.94,30,5,2,footwear,2020-10-17
Baffin Sequoia Waterproof Winter Boots - Men's,Baffin,239.95,0,3.5,6,footwear,2020-10-17
"Timberland Original 6"" Boots - Men's",Timberland,184.95,0,4.4,371,footwear,2020-10-17
Salomon Toundra Pro CS Waterproof Winter Boots - Men's,Salomon,279.95,0,3.7,50,footwear,2020-10-17
Hoka One One Torrent 2 Trail Running Shoes - Men's,Hoka,149.95,0,3.4,12,footwear,2020-10-17
Columbia Fairbanks Omni-Heat Winter Boots - Men's,Columbia,159.95,0,4.6,224,footwear,2020-10-17
New Balance Minimus 10v1 Trail Running Shoes - Men's,New Balance,149.95,0,3.5,11,footwear,2020-10-17
Brooks Ghost 13 Road Running Shoes - Men's,Brooks,169.95,0,4.3,323,footwear,2020-10-17
Brooks Cascadia 15 Trail Running Shoes - Men's,Brooks,159.95,0,4.6,18,footwear,2020-10-17
The North Face Ultra Fastpack IV Mid FutureLight Light Trail Shoes - Men's,The North Face,199.99,0,1,2,footwear,2020-10-17
Scarpa Maverick Mid Gore-Tex Hiking Boots - Men's,Scarpa,199.95,0,0,0,footwear,2020-10-17
Timberland Davis Square Leather and Fabric Shoes - Men's,Timberland,99.95,0,4.6,85,footwear,2020-10-17
La Sportiva Trango Tech Leather Gore-Tex Mountaineering Boots - Men's,La Sportiva,329.95,0,4.3,3,footwear,2020-10-17
Columbia Newton Ridge Plus II Waterproof Hiking Boots - Men's,Columbia,139.95,0,4.6,664,footwear,2020-10-17
New Balance 1400v6 Road Running Shoes - Men's,New Balance,129.95,0,5,1,footwear,2020-10-17
Vasque Talus AT Ultradry Hiking Boots - Men's,Vasque,179.95,0,3.5,4,footwear,2020-10-17
Oboz Bozeman Low Shoes - Men's,Oboz,159.95,0,0,0,footwear,2020-10-17
Lowa Camino Gore-Tex Backpacking Boots - Men's,Lowa,419.95,0,3.5,2,footwear,2020-10-17
Vibram FiveFingers KSO EVO Shoes - Men's,Vibram,129.95,0,4.5,20,footwear,2020-10-17
Ecco Byway Tred Sneakers - Men's,Ecco,239.95,0,0,0,footwear,2020-10-17
Merrell Bare Access XTR Trail Running Shoes - Men's,Merrell,129.95,0,0,0,footwear,2020-10-17
Vasque Breeze LT Low Gore-Tex Light Trail Shoes - Men's,Vasque,189.95,0,3.8,10,footwear,2020-10-17
Keen Targhee III Slip-On Shoes - Men's,Keen,129.95,0,0,0,footwear,2020-10-17
Merrell Thermo Glacier Mid Arctic Grip Waterproof Boots - Men's,Merrell,249.95,0,3.5,4,footwear,2020-10-17
Keen Explore Mid Waterproof Light Trail Shoes - Men's,Keen,159.95,0,5,1,footwear,2020-10-17
Merrell Trail Glove 5 Leather Shoes - Men's,Merrell,159.95,0,5,1,footwear,2020-10-17
Saucony Guide 13 TR Trail Running Shoes - Men's,Saucony,111.94,30,5,1,footwear,2020-10-17
Salomon Outblast TS Waterproof Winter Boots - Men's,Salomon,179.95,0,4.4,5,footwear,2020-10-17
Timberland Groveton Leather Chukkas - Men's,Timberland,99.95,0,4.6,215,footwear,2020-10-17
Baffin Zone Waterproof Winter Boots - Men's,Baffin,179.95,0,3.4,27,footwear,2020-10-17
Scarpa Mojito Outdoor Athletic Shoes - Men's,Scarpa,179.95,0,4.8,17,footwear,2020-10-17
Salomon Outbound Light Trail Shoes - Men's,Salomon,69.93,42,5,3,footwear,2020-10-17
Merrell MQM Flex 2 Gore-Tex Invisible Fit Light Trail Shoes - Men's,Merrell,169.95,0,0,0,footwear,2020-10-17
New Balance Fresh Foam Hierro V5 Gore-Tex Trail Running Shoes - Men's,New Balance,199.95,0,3,1,footwear,2020-10-17
Kodiak Magog Waterproof Insulated Boots - Men's,Kodiak,194.95,0,0,0,footwear,2020-10-17
Zamberlan 1111 Aspen Gore-Tex RR Backpacking Boots - Men's,Zamberlan,409.95,0,4,1,footwear,2020-10-17
Zamberlan 960 Guide Gore-Tex RR Hiking Boots - Men's,Zamberlan,379.95,0,4.7,15,footwear,2020-10-17
La Sportiva Wildcat Trail Running Shoes - Men's,La Sportiva,124.95,0,4.5,55,footwear,2020-10-17
Merrell Coldpack Ice+ Moc Arctic Grip Waterproof Winter Boots - Men's,Merrell,179.95,0,5,1,footwear,2020-10-17
Merrell Moab FST Ice+ Waterproof Thermo Winter Boots - Men's,Merrell,117.58,44,2,4,footwear,2020-10-17
Kodiak Fundy Waterproof Insulated Boots - Men's,Kodiak,179.95,0,0,0,footwear,2020-10-17
Zamberlan 205 Stroll Gore-Tex Light Trail Shoes - Men's,Zamberlan,219.95,0,0,0,footwear,2020-10-17
Saucony Peregrine 10 Trail Running Shoes - Men's,Saucony,149.95,0,5,1,footwear,2020-10-17
Keen Targhee III Casual Shoes - Men's,Keen,139.95,0,3,2,footwear,2020-10-17
La Sportiva Boulder X Approach Shoes - Men's,La Sportiva,139.95,0,4.7,48,footwear,2020-10-17
Keen Austin Outdoor Lifestyle Shoes - Men's,Keen,149.95,0,3.6,58,footwear,2020-10-17
Timberland Norton Ledge Warm Lined Waterproof Boots - Men's,Timberland,159.95,0,4.8,25,footwear,2020-10-17
Brooks Ghost 12 Gore-Tex Road Running Shoes - Men's,Brooks,128.93,30,4,81,footwear,2020-10-17
Merrell Trail Glove 5 Eco Trail Running Shoes - Men's,Merrell,159.95,0,0,0,footwear,2020-10-17
Kodiak Rover II Arctic Grip SaltShield Waterproof Insulated Boots - Men's,Kodiak,194.95,0,2.5,2,footwear,2020-10-17
Saucony Peregrine ICE+ Trail Running Shoes - Men's,Saucony,189.95,0,5,1,footwear,2020-10-17
Bogs Ovecast Chelsea Rain Boots - Men's,Bogs,84.95,0,0,0,footwear,2020-10-17
Brooks Ghost 13 Run Visible Road Running Shoes - Men's,Brooks,169.95,0,4.3,323,footwear,2020-10-17
Salomon XA Wild Gore-Tex Trail Running Shoes - Men's,Salomon,189.95,0,3.2,4,footwear,2020-10-17
Keen Newport H2 Sandals - Men's,Keen,119.95,0,3.9,110,footwear,2020-10-17
On Cloudventure Trail Running Shoes - Men's,On,189.95,0,5,1,footwear,2020-10-17
Altra Escalante 2.5 Road Running Shoes - Men's,Altra,179.95,0,0,0,footwear,2020-10-17
Muck Arctic Ice Arctic Grip Tall Winter Boots - Men's,Muck,229.95,0,0,0,footwear,2020-10-17
Columbia SH/FT Outdry Mid Light Trail Shoes - Men's,Columbia,179.95,0,4.3,118,footwear,2020-10-17
Salomon XA Wild Trail Running Shoes - Men's,Salomon,159.95,0,4,7,footwear,2020-10-17
Columbia Trans Alps F.K.T. III Trail Running Shoes - Men's,Columbia,107.94,30,0,0,footwear,2020-10-17
Black Diamond Circuit Shoes - Men's,Black Diamond,119.95,0,5,2,footwear,2020-10-17
Baffin Snow Monster Waterproof Winter Boots - Men's,Baffin,269.95,0,4.3,14,footwear,2020-10-17
Ecco Exostride Synthetic Gore-Tex Sneakers - Men's,Ecco,199.95,0,0,0,footwear,2020-10-17
La Sportiva Baruntse Mountaineering Boots - Men's,La Sportiva,469.93,50,4.8,6,footwear,2020-10-17
Oboz Bridger Premium Mid B-Dry Hiking Shoes - Men's,Oboz,269.95,0,5,1,footwear,2020-10-17
Scarpa Moraine Mid Gore-Tex Light Trail Shoes - Men's,Scarpa,229.95,0,4.5,61,footwear,2020-10-17
Lowa San Francisco Gore-Tex Surround Low Shoes - Men's,Lowa,194.94,25,0,0,footwear,2020-10-17
New Balance Summit Unknown v2 Trail Running Shoes - Men's,New Balance,149.95,0,0,0,footwear,2020-10-17
Olukai Nohea Mesh Slip On - Men's,Olukai,99.95,0,3.8,15,footwear,2020-10-17
Merrell Altalight Mid Waterproof Light Trail Shoes - Men's,Merrell,189.95,0,0,0,footwear,2020-10-17
Brooks Divide Trail Running Shoes - Men's,Brooks,139.95,0,4.3,20,footwear,2020-10-17
Crocs Literide Pacer Shoes - Men's,Crocs,74.95,0,4.6,350,footwear,2020-10-17
